{
  "roadmap_id": "marketscalping_master_roadmap",
  "version": "2026.09.13",
  "name": "MarketScalping Master Roadmap",
  "description": "Project planning artifact for the MarketScalping program. This is a planning authority only and does not mutate runtime workflow state.",
  "source_of_truth": "planning-only",
  "stages": [
    {
      "stage_id": "6",
      "title": "STEP 6 — Financial-State Architecture",
      "description": "Establish the authoritative financial state model, startup recovery, and fail-closed reconciliation contract without changing live trading authority.",
      "parent_stage_id": null,
      "depends_on": [],
      "risk_level": "high",
      "owner": "architect",
      "target_workflow_state": "READY",
      "required_evidence": [
        "ADR 0002 accepted",
        "ADR 0003 accepted",
        "startup recovery gate validated",
        "financial state authority documented"
      ],
      "exit_criteria": [
        "Account ledger identified as authority",
        "PositionManager treated as derived projection",
        "Startup recovery is fail-closed and deterministic",
        "Execution journal is evidence-only"
      ],
      "human_approval_required": false,
      "evidence_refs": [
        ".agent/adr/0002-financial-state-source-of-truth.md",
        ".agent/adr/0003-recovery-and-reconciliation.md",
        "PROJECT_MILESTONES.md"
      ],
      "notes": "Step 6 is complete only when the financial authority model and recovery gate are validated and remain isolated from live-trading execution."
    },
    {
      "stage_id": "6A",
      "title": "6A — Financial-State Architecture Investigation",
      "description": "Audit the current architecture and establish the authority model for accounting, execution, and position state.",
      "parent_stage_id": "6",
      "depends_on": [],
      "risk_level": "high",
      "owner": "architect",
      "target_workflow_state": "READY",
      "required_evidence": [
        "architecture audit artifacts",
        "authority split documented",
        "source-of-truth analysis complete"
      ],
      "exit_criteria": [
        "Execution, accounting, and position responsibilities are explicit",
        "PositionManager is not financial authority",
        "AccountingEngine is identified as authoritative ledger"
      ],
      "human_approval_required": false,
      "evidence_refs": [
        ".agent/adr/0002-financial-state-source-of-truth.md",
        "PROJECT_MILESTONES.md"
      ],
      "notes": "This milestone is already completed in the repo and is the basis for the downstream financial-state contract."
    },
    {
      "stage_id": "6B",
      "title": "6B — Financial-State Authority",
      "description": "Convert the financial authority design into explicit recovery and reconciliation responsibilities.",
      "parent_stage_id": "6",
      "depends_on": ["6A"],
      "risk_level": "high",
      "owner": "architect",
      "target_workflow_state": "READY",
      "required_evidence": [
        "recovery lifecycle documented",
        "projection rebuild contract documented",
        "fail-closed startup gate defined"
      ],
      "exit_criteria": [
        "Accounting state is recovered before market-event processing",
        "Position projection is rebuilt from accounting state",
        "Divergence blocks startup instead of silently continuing"
      ],
      "human_approval_required": false,
      "evidence_refs": [
        ".agent/adr/0003-recovery-and-reconciliation.md",
        ".agent/adr/0002-financial-state-source-of-truth.md"
      ],
      "notes": "This milestone is already completed in the repo and is the recovered authority contract."
    },
    {
      "stage_id": "6C",
      "title": "6C — Financial-State-Aware Risk",
      "description": "Define the risk architecture that is aware of financial state, exposure, position, and loss controls before executing any risk-sensitive behavior.",
      "parent_stage_id": "6",
      "depends_on": ["6A", "6B"],
      "risk_level": "high",
      "owner": "architect",
      "target_workflow_state": "ARCHITECTURE",
      "required_evidence": [
        "risk-state contract",
        "position/exposure limits design",
        "loss-controls design"
      ],
      "exit_criteria": [
        "Risk state contract is defined",
        "Risk gate boundaries are explicit",
        "Financial state is available to pre-commit risk checks"
      ],
      "human_approval_required": false,
      "evidence_refs": [],
      "notes": "The Stage 6 gate is not considered closed until all 6C sub-stages complete and exit criteria are satisfied."
    },
    {
      "stage_id": "6C.1",
      "title": "6C.1 — Risk Architecture Investigation",
      "description": "Investigate the risk-state design, exposure model, and execution permission boundaries required before implementing production risk logic.",
      "parent_stage_id": "6C",
      "depends_on": ["6A", "6B"],
      "risk_level": "high",
      "owner": "architect",
      "target_workflow_state": "ARCHITECTURE",
      "required_evidence": [
        "risk architecture analysis",
        "risk-state problem statement",
        "current risk gaps identified"
      ],
      "exit_criteria": [
        "Current gap between strategy and financial-state risk is explicit",
        "Required risk contracts are enumerated",
        "Implementation plan is created without implementing risk logic"
      ],
      "human_approval_required": false,
      "evidence_refs": [],
      "notes": "This is the next planned milestone and is currently eligible to proceed after Step 6 authority foundations are recognized as satisfied."
    },
    {
      "stage_id": "6C.2",
      "title": "6C.2 — Risk State Contract",
      "description": "Define the explicit risk-state contract and request/response data model required for gating decisions.",
      "parent_stage_id": "6C",
      "depends_on": ["6C.1"],
      "risk_level": "high",
      "owner": "architect",
      "target_workflow_state": "READY",
      "required_evidence": [
        "risk-state schema",
        "state ownership boundaries",
        "risk input/output contract"
      ],
      "exit_criteria": [
        "Risk contract is precise",
        "No financial authority is delegated to RiskEngine",
        "Risk gating remains pre-commit only"
      ],
      "human_approval_required": false,
      "evidence_refs": [],
      "notes": "This milestone is blocked until 6C.1 exits successfully."
    },
    {
      "stage_id": "6C.3",
      "title": "6C.3 — Position / Exposure Limits",
      "description": "Define position, exposure, and concentration limits as explicit policy constraints instead of ad-hoc calculations.",
      "parent_stage_id": "6C",
      "depends_on": ["6C.2"],
      "risk_level": "high",
      "owner": "risk",
      "target_workflow_state": "READY",
      "required_evidence": [
        "position limit model",
        "exposure limits",
        "concentration rules"
      ],
      "exit_criteria": [
        "Position exposure limits are explicit",
        "Exposure checks are testable",
        "No trade can bypass position limits"
      ],
      "human_approval_required": false,
      "evidence_refs": [],
      "notes": "Deferred until the risk-state contract is validated."
    },
    {
      "stage_id": "6C.4",
      "title": "6C.4 — Risk-per-Trade",
      "description": "Specify the per-trade risk budget, position sizing, and acceptance criteria for single-trade exposure.",
      "parent_stage_id": "6C",
      "depends_on": ["6C.3"],
      "risk_level": "high",
      "owner": "risk",
      "target_workflow_state": "READY",
      "required_evidence": [
        "trade risk budget",
        "position sizing model",
        "stop-loss and exposure assumptions"
      ],
      "exit_criteria": [
        "Maximum per-trade risk is explicit",
        "Per-trade risk can be reproduced in validation",
        "No trade is accepted without a risk gate decision"
      ],
      "human_approval_required": false,
      "evidence_refs": [],
      "notes": "Requires prior exposure-limit definition."
    },
    {
      "stage_id": "6C.5",
      "title": "6C.5 — Loss Controls",
      "description": "Specify daily, session, and drawdown-based loss controls that are enforced before execution proceeds.",
      "parent_stage_id": "6C",
      "depends_on": ["6C.4"],
      "risk_level": "critical",
      "owner": "risk",
      "target_workflow_state": "READY",
      "required_evidence": [
        "daily loss limits",
        "drawdown controls",
        "kill conditions"
      ],
      "exit_criteria": [
        "Loss controls are explicit and testable",
        "No trade can bypass daily drawdown constraints",
        "Human intervention remains required for defined escalation paths"
      ],
      "human_approval_required": false,
      "evidence_refs": [],
      "notes": "Used to support the fail-safe architecture before any live-trading stage."
    },
    {
      "stage_id": "6C.6",
      "title": "6C.6 — Risk Gate Integration",
      "description": "Integrate the risk gate into the execution-precondition path without granting RiskEngine financial authority.",
      "parent_stage_id": "6C",
      "depends_on": ["6C.5"],
      "risk_level": "high",
      "owner": "architect",
      "target_workflow_state": "DEVELOPMENT",
      "required_evidence": [
        "risk gate integrated with execution boundary",
        "risk gate remains pre-commit only",
        "no bypass path allowed"
      ],
      "exit_criteria": [
        "Risk gate is enforced before execution acceptance",
        "Execution is still evidence-only relative to accounting",
        "No risk component mutates accounting state"
      ],
      "human_approval_required": false,
      "evidence_refs": [],
      "notes": "This is integration only; it must not enable live trading."
    },
    {
      "stage_id": "6C.7",